,full_text,tweet_english
512,program 02 bahaya sektor makan gratis bansos 20 ikn food estate bilang alutsista bakal lebih kuat pimpin pak prabowo mohon awal sektor,program 02 danger free food sector bansos 20 ikn food estate said alutsista will be stronger lead pak prabowo please start sector
513,bagus program cuma 2 juta duduk ikn perlu dukung program depopulasi nasional,"good, the program is only 2 million, it needs to support the national depopulation program"
514,this thread is proving kalo investor dar awal udah kasih arah siapa menang sampe ihsg langsung ngerespon positif hingga 2 saham usaha kait 02 program ikn juga mostly naik nguasai ihsg hasil quick count,this thread is proving that investors from the beginning have given directions to who wins until ihsg immediately responds positively to 2 hook business shares 02 IKN programs also mostly go up to master ihsg quick count results
515,sangat nyambung program lanjut jokowi ken perata ekonomi bangun ikn,very connected to the program further jokowi ken perata economy build ikn
516,partai dukung 01 03 milik hampir 50 kursi dpr juga 02 jadi semua program anggar di aju 02 dapat tuju partai dukung 01 03 01 tolak ikn 03 minta kaji ulang 02 apa bisa tertawa,party support 01 03 belongs to almost 50 dpr seats also 02 so all fencing programs in aju 02 can go to the party support 01 03 01 reject 03 ask for a review 02 can you laugh
517,mas wapres program transmigrasi ikn aku lok,mas vice president of transmigration program ikn aku lok
518,kasih program kesejahteraaan depan bangun faskes didik transportasi umum tolak gilir ikn bela matimatian endingnya cuma senang 2 juta orang aja pun gue yakin banyak kelas tengah atas,love the welfare program in front of building faskes students of public transportation refuse to take turns defending matimatian ending is only happy for 2 million people I'm sure a lot of the upper middle class
519,jadi biaya ikn biaya makan gratis hampir sama tanya ikn aja nyari2 investorhutang lalu program makan gratis duit mana akan pangkas subsidi naik pajak sdh jawab tanya tanya ikut sdh hitung brp naik bbm pajak,"so the cost of ikn the cost of free food is almost the same, just ask ikn nyari2 investors and then the free meal program, which money will cut subsidies, increase taxes, sdh, answer questions, follow the count, bp, increase tax bbm"
520,kamu suka cari tau dulu emang masuk program anies tp ikn udah masuk uu siapa jd presiden harus patuh uu masa gt aja tidak paham,you like to find out first to enter the anies program but if you have entered uu who is jd the president must obey uu when gt just don't understand
521,emang bukan satu2 nya sih program makan gratis prabowomasih banyak program2 masuk akal nyaseperti bagi2 ribu rumah tiap desa seluruh indonesia lanjut ikn food estate gagal lanjut untung buat usaha diaapa ya,"it's not the only one, the free meal program is prabowomasih, many programs make sense, such as for 2 thousand houses in every village throughout Indonesia, further ikn food estate fails further profit for the business, why?"
522,edar tktok bapak jabat menteri tahan mohon tanggap kait scene simpons bawah pak ini lanjut dr program ikn pak jokowi akan pak prabowo lanjut ikn jadi singapore,circulate tktok Mr. Acting Minister hold please respond to the hook scene simpons below this sir continue from the program ikn pak jokowi will pak prabowo continue ikn become singapore
523,waw gara2 1 org bayi kurang gizi tuduh semua program gagal bagaimana dg jokowi orang bapak ntt robek perut sendiri tidak bs kasih makan anak jokowi dg bangga bangun ikn dg megah sisi indonesia lain tidak rata,waw gara2 1 baby malnourished accused of all failed programs how about jokowi the father ntt ripped his own stomach can not feed jokowi children proudly wake up ikn with magnificent other side of Indonesia uneven
524,silent majority all in terus program pak jokoi apa jadi teteup pegang teguh thd makan susu gratis bansos anti ngeluh semua mahal tetap satu maju sama ikn,silent majority all in continue the program sir jokoi what so teteup hold firmly thd eat milk free bansos anti complain all expensive stay one forward same ikn
525,paling jawab tidak nyambung tanya program apa jawab ikn libat kan apa hubung,most answered do not continue to ask what program to answer if you want to involve what is the connection
526,dg pola sama mobil esemka ikn tahun 2029 mau lanjut program makan siang,"with the same pattern as the esemka IKN car in 2029, want to continue the lunch program"
527,program makan siang susu gratis bakal jalan tambah ikn bakal terus jalan bayang kali berapa dana dikeluarin otomatis harus ada dikorbanin kan buat realisasi semua,the free milk lunch program will go further and will continue to run in the shadow of how many times the funds are automatically spent there must be sacrificed right for the realization of all
528,tau gasih bu jalan program makan siang gratis ikn anggar ambil bagi naik pajak hapus subsidi bbm ibu bayang kalau pertalite udah ada otomatis harga bahan pokok naik sekarang aja,know gasih bu jalan free lunch program ikn fencing take to increase taxes remove subsidies bbm mother shadow if pertalite is already there automatically the price of staples goes up just now
529,nah loh tau sadar masih kota2 tinggal perlu dimajuin kamu malah lebih pilih paslon bahkan ada program bangun daerah2 kayak 02 yang cuma fokus ikn,"well, you know, it's still aware that the cities you live in need to be advanced, you even prefer paslon, there is even a program to build areas like 02 which only focuses on IKN"
530,mending dimanaaaa bangun ikn segitu aja kamu udah demo program kembang 40 kota bisa abisin bas ribu trilliun kamu dukung gila bener idealisme sama standar ganda orang,mending whereaaa wake up ikn just like that you have a demo of the 40 city development program can abisin bus thousand trillion you support crazy bener idealism same standard double people
531,bangun ikn aja udah hina abis sama orang kamu nanyain urgensi apa terus malah mau bikin program 40 kota tara jakarta dana abisin lipat itu program kamu tanya,build ikn aja already despised abis with your people ask what urgency do you continue to even want to make a program of 40 cities tara jakarta fund abisin folding the program you ask
532,kl kalian sebut program makan siang gratis masuk akal lebih tidak masuk akal bangun 40 kota se level jakarta ikn aja bangun lama ampe tahun 40 kota real omong kosong,if you call the free lunch program reasonable more unreasonable build 40 cities at the level of jakarta ikn just build old ampe year 40 real city bullshit
533,lho kan lanjut lagi seposthink apasih kamu program wowo big modal semua kamu pikir gabakal mangkas uang bbm didik sehat bayangin makansiang gratis bikin 300 fk baru lanjtin ikn you think uang pake daun pasti ngambil dana apbn sektor,you know more seposthink apasih you program wowo big capital all you think gabakal mangkas wang bbm student sehat shadowin makansiang gratis make 300 fk baru lanjtin ikn you think money use leaves definitely take funds apbn sector
534,tanya dr mas banyak program secomplex bareng ada berapa uang negara perlu jadi modal ngomongin ikn lain2 ya kata mas tahap tentu kalau anggar siap mindset hingga program rampung,"ask Dr. Mas how many secomplex programs together there is how much state money needs to be a capital to talk about others, yes, said Mas, the stage is certainly if the fencing is ready to think until the program is completed"
535,klo inimah ibukota bukan pindah ikn ke bal program makan duren gratis,klo inimah the capital is not moving IKN to bal the free duren meal program
536,kalau subsidi energi butuh kurang arti rupa hemat apbn mana kemudian hemat kan pakai biaya program ujar maksud bukan mangkas subsidi bbm makan siang gratis program lain tuh apa ikn,"if the energy subsidy needs less meaning, saving money, which then saves money, use the cost of the program, the point is not to trim the free bbm lunch subsidy, what other program is it?"
537,arti program makan siang gratis akan realisasi bangun ikn selesai,the meaning of the free lunch program will be the realization of waking up if finished
538,yuuk jangan sampe merana sakit hati slama 5 tahun rubah terima nyata rakyat nkri cinta jokowi program pro rakyat lanjut prabowo gibran gt alhamdulillah program ikn akan lanjut jadi simbul negara tuju indonesia emas,yuuk do not suffer from heartache slama 5 years fox receive real people nkri love jokowi pro people's program further prabowo gibran gt thank God the IKN program will continue so symbul country aiming for indonesia gold
539,just in case program ikn lanjut paslon 02 mereka menang program butuh biaya tara bangun ikn selamat pusing ria deh kalau pajak di naik lebih tinggi,"just in case the IKN program continues with PASLON 02 they won the program it takes a tara fee to build IKN, congratulations and dizziness if taxes go up higher"
540,biaya bangun ikn 466t program makan siang 450t tahun kita saja punya 5 kota kelas ikn 1 periode,building costs ikn 466t lunch program 450t year we alone have 5 cities ikn class 1 period
541,nama bangun infrastruktur wujud harus bangun wajar perlu waktu jelas anggar ambil dana ikn bisa sama program makan siang gratis serentak bisa jadi masalah kan anggar sekarang bingung kan nyarinya gimana,name build infrastructure form must wake up reasonable need time clear fencing take funds ikn can be the same free lunch program simultaneously can be a problem right fencing now confused how
542,paling masuk akal tp resiko buang anggar lampau gede mbak program kuliah gratis makan siang gratis 3jt rumah gratis ikn 1525jt sapi impor buat susu anak 10000 beasiswa luar negeri 300 dokter baru kuliah dokter gratis kira brpa pajak naik amp,"most reasonable but the risk of wasting past fencing is great, bro, free lecture program, free lunch, free 3m homes, free ikn, 1525m imported cows for children's milk, 10000 foreign scholarships, 300 new doctors, free doctor's study, think brpa taxes go up, amp"
543,gue gatau dah sama kaum belah food estate suruh cepet ikn suruh cepet sekarang program pun suruh cepet kalian ngapa sih gabisa sabar dulu,me or have the same people split the food estate tell them to be quick and tell them to be quick now the program also tells them to be quick why can't you be patient first
544,bagus sih bagus liat dong kondisi prioritas makan gratis iya cuma ajar sdsma ikn iya giant sea wall mungkin iya programprogram dana masif dari apbn semua terus janji naikkin gaji asn bagai masuk akal ga,"good, look at the condition of the priority of eating for free, yes, just teach sdsma ikn, yes, giant sea wall, maybe yes, massive fund program from apbn all continue to promise to increase the salary asn seems reasonable, no"
545,apbn sudah defisit parah perintah hibur diri tp masyarakat tanggung beban kalo kata bu connie pa prabowo tambah utang jumlah besar di nafsu ikn program makan siang dapat negara sudah keok korupsi,apbn has a severe deficit of self-entertainment orders but the community bears the burden if the word bu connie pa prabowo adds a large amount of debt in the lust ikn lunch program can the country has become corrupt
546,masalah narasi edar potong subsidi bbm tsb alokasi program makan gratis bukan bangun kota masing2 maksud pak anies tunda ikn kembang kota ada semua org punya akses yang sama segala aspek,"the problem of circulation narrative is cutting bbm subsidies, the allocation of free meal programs, not building their respective cities, the purpose of Pak Anies is to delay the development of the city, there are all people who have the same access to all aspects"
547,ikn aja proses bertahuntahun sim salabim jadi ptsl 126juta bidang tanah nggak sim salabim jadi program perintah skala besar mana langsung realisasi 100 target hari pertama tahun pertama laksana,ikn just a multi-year process of sim salabim into ptsl 126 million parcels of land not sim salabim into a large-scale command program which directly realizes 100 targets on the first day of the first year like
548,program 02 lebih jelas melanjutkanprogram anis apa mau ubah ikn dilanjutkankdang bilang stopbbm gratis bbm gratis gimana cara nya anis lebih masuk akal mkan siang grtis bgi anak sd dripada bbm gratis 01lebih fokus nyerang drpd lihat dr sndri,program 02 more clearly continue anis program what do you want to change ikn continuedkdang say stopbbm gratis bbm gratis how to make anis more reasonable mkan hari grtis bgi anak sd dripada bbm gratis 01lore focus nyerang than see from sndri
549,liat share apbn 2024 sehat paling kecil dana dibutuhin buat program makan siang tuh besar jd bakal trade off dana dibutuhin hampir tara ikn lebih besar infrastruktur jd tanya layak trade off program makan siang,clay share apbn 2024 healthy smallest funds needed for lunch program tuh big jd will trade off funds needed almost tara ikn bigger infrastructure jd ask feasible trade off lunch program
550,dia cerdas bilang bodoh sebenernya orang asli bodoh tp insecure aja haha gue sendiri cumlaude pilih 02 banyak bisa liat aspek lanjut investoratas ikn tumbuh ekonomi program makan siang gratis program hilir,he was smart to say he was stupid but he was insecure but haha I myself cumlaude choose 02 many can see further aspects of investors above to grow the economy free lunch program downstream program
551,masalah mungkin program makan gratis bukan visimisi prioritas jargon rebut simpati untuk 5thn depan seperti bangun ikn jadi program utama prioritas vvip sampe tantrum kami paham,problems maybe the free meal program is not a priority vision jargon grab sympathy for the next 5thn like wake up ikn be the main program of priority vvip until tantrum we understand
552,gw dulu emg tuju sama ikn soal program beneran matiin hutan populasi hewan lagi jadi ladang invest tambang bakal banyak warga tempat dampak sama tp banyak orang sana pro ikn sedih sih kurang sosialisasi,i used to go the same way ikn about the real program to die in the animal population forest again so the mine investment field will have many residents where the same impact but many people there are pro ikn sad about the lack of socialization
553,ikn program glorifikasi suatu negara bukan perata,if a country's glorification program is not flattening
554,jokowi temu megawati ingin ikn lanjut suara pkb pks nasdem pdip buat semua program ikn henti,jokowi temu megawati want to continue the sound of pkb pks nasdem pdip for all programs ikn stop
555,ga bayang program bangun 40 kota tara ikn hari,no shadow of the program to build 40 cities tara ikn hari
556,wk mslahnya cra pkir org awam bkn liat analisa fundamental teknikal bang inti org kagum sama prabowo udah 3x calon jd presiden d kalimantan org plih prabowo krna program ikn nya aja gk mlihat visi misi lain,wk mslahnya cra pkir org layman bkn clay technical fundamental analysis bang core org amazed with prabowo already 3x candidate jd president d kalimantan org plih prabowo krna program ikn nya aja gk mlihat vision mission lain
557,dukung 01 n 03 sibuk ngulik program paslonnya sndr biar g kena tipu mana sempet ngulik org masa visi misi paslon dukung mesti dijelasin sama dukung sh liat permukaanny aja ken ikn n maksi gratis aj udah g msk akal dana drmn kn udah digembor2 tuh,support 01 n 03 busy snatching the program paslonnya sndr so that g got tricked where sempet ngulik org time vision mission paslon support must be clarified same support sh clay surface aja ken ikn n maksi gratis aj udah g msk akal dana drmn kn already dibembor2 tuh
558,kwkwkkwkw dukung bowo gk tahu kalo program tahap dah tahu banget gw awal udah tau gk bakal mungkin makan siang gratis ikn 460 t makan siang gratis 460 t anggar lain ada devisit apbn kwkwkw bbm lpg 3 kg jadi korban,kwkwkkwkw support bowo gk know if the stage program already know very early gw already know gk will be possible free lunch ikn 460 t free lunch 460 t other fencing there is devisit apbn kwkwkw bbm lpg 3 kg become a victim
559,temenku dr gigi org kalimantan dukung 02 ikn berlanjutgt kota majugt tanah dan bapak naik nilai karirnya naik oh bapak kader gerindra alas simply lanjut program jokowi yang bakal nguntungin ybs bodoamat ama org,my friend from the teeth of the people of kalimantan support 02 ikn continuegt the city majugt land and father rose his career value up oh father gerindra cadre alas simply continue the jokowi program that will nguntungin ybs bodoamat ama org
560,silent majority silent majority tolol noh gegara program junjung kamu apbn bakal boncos udah program ikn tambah program makan susu gratis akhir dampak subsidi bbm mungkin hapus naik harga bbm pengaruh harga bahan pokok,silent majority silent majority noh gegara program uphold you apbn will boncos already program ikn add free milk eating program end the impact of bbm subsidies may erase rising bbm prices the effect of the price of basic commodities
561,aja ikn besok program utama luas bangun rutan 40 tara nusakambangan,aja ikn tomorrow the main program wide build rutan 40 tara nusakambangan
562,lah program anies udah dijalanin sesuai visi misi kok dp 0 dinaikin batas gaji ya emang kurang minat makanya cakup dinaikin buat banjir persentase turun drastis korban jiwa alhamdulillah lebih sedikit resap air dipake sama ikn kan,"is that the anies program has been carried out according to the vision and mission, why dp 0 raised the salary limit, yes, there is less interest, so the coverage is raised for flooding, the percentage drops drastically, the death toll is alhamdulillah, less water absorption is used equally, right?"
563,nah brrti program kurang realistis buat sebut program unggul kan at the same time gue ambil contoh program kembang 40 kota gagas 01 sumber dana drmn relokasi anggar bangun ikn belum jalan dmn total 320t bs ngebangun 40 kota level jkt,well brrti program is not realistic to call it a superior program right at the same time I take the example of the 40 city flower program gagas 01 source of funds drmn relocation fencing building ikn not yet run dmn total 320t bs building 40 city level jkt
564,alas banyak milih 02 artis nya semua d sna dmn tau puja artis d indo dewa sekalibanos gk hbs nyaprogram ikn jadi iming2 rakyat emg trick joko ikn hrus d acc sblm milu buat daganganjanji grts sna sni emg silent stupidity emg lbh percya artis,alas many choose 02 artists all d sna dmn tau puja artist d indo dewa sekibanos gk hbs nyaprogram ikn jadi lure2 rakyat emg trick joko ikn hrus d acc sblm milu buat tradjanji grts sna sni emg silent stupidity emg lbh percya artis
565,gak ngurus penting udah menang program pak jokowi tetap berlanjutikn lanjuthilirisasi tetap lanjut ngurus bacot orang tololl kayak kamu indonesia makin maju,"don't take care it's important to have won the Pak Jokowi program, keep going, keep going, keep going, keep going, keep on taking care of people like you, Indonesia is getting more advanced"
566,2 oke kl emang capai 2029 ada roadmap implementasi detail anggar sampe sekarang abuabu ujung2nya pake cara koersif pangkas subsidi sektor penting kaya bbm likely didik sdgkn program nonurgent kaya ikn sampe 400 t per tahun aman2 aja,2 okay kl emang reach 2029 there is a roadmap for implementation of sampe fencing details now abuabu the ends use a coercive way to cut subsidies for important sectors rich bbm is likely to learn sdgkn nonurgent program rich ikn up to 400 t per year aman2 aja
567,lah ikn doang mana tolol jelas dr aceh smpe papua bangun bangun eoi liat hasil survei papua 02 menang telak kan lanjut program jokowi ngebangun papua,lah ikn doang mana moron obviously dr aceh smpe papua Bangun Bangun eoi Liat result survey papua 02 Win decisively right continue the program jokowi ngebangun papua
568,timbang program anggar 400t emang banyak mangkas anggar ikn pangkas kok jadi kita tunggu budgeting nya 2025,weigh the 400t fencing program is a lot of trim fencing ikn trim so we wait for the budgeting 2025
569,visi misi lampau luar biasasemua paslon tapi turut 01 02 rada outrageous mulai bbm gratis samping iknpembangunan 40 kota tara jakarta semua contoh program harus kaji ulang,vision past mission extraordinary all candidates but also 01 02 rada outrageous start free bbm side ikndevelopment of 40 cities tara jakarta all examples of programs must be reviewed
570,100 untuk target 2029 ikn aja tahun bom jadi emang mau pake bantu jin hari jadi tuh program debat dukung wan angin selamat akal pikir,100 for the target of 2029 ikn just the year of the bomb so I want to use it to help the genie on the anniversary of the debate program to support the wind safe thinking
571,paling gampang kayak buka lahan baru sekitar ikn kalimantan itu bakal kontra sama program lestari hutan satwa liar sih,the easiest way to open new land around the Kalimantan IKN will be the same cons of the wildlife forest sustainability program
572,program jokowi utama ikn akan buang buang anggar,the main jokowi program will throw away the fencing
573,njir temen gue milih 02 cuma perkara suka sama bodyguardnya si 02 anjiiir mending lah kalau jawab apa gitu ntah suka sama program ikn lah perkara suka sama bodyguardnya bisa berkatakata aku,njir my friend chose 02 just a matter of liking the bodyguard si 02 anjiiir mending lah if the answer is what so ntah like the same program ikn is a matter of liking the bodyguardnya can say I
574,bingung ya naik rasio pajak 23 butuh ada ikn makan siang gratis dana desa 5m food estate program lain artikel makin banyak tax ratio makan makin banya sektor kena pajak masalah masyarakat mampu,"confused, up the tax ratio of 23, there needs to be a free lunch for village funds, 5m food estate, another program, the more tax ratios eat, the more the taxable sector can afford community problems"
575,gua blg dulu gua kmrn coblos 3 3 nya jd gua dukung siapa cuma gua suka ama program ikn gin ikn bkl jd pasak tanam kalimat layak pasak kembang jalar akar sekitar itu yang ingin program ikn ada dulu pusat,cave first kmrn coblos 3 3 jd caves support who only caves like ama program ikn gin ikn bkl jd planting stakes sentences worthy of staking the roots of the vine around it who wants to program ikn there first center
576,program prabowo lain kayak bangun ikn dana desa 5m 10000 beasiswa ln juga butuh anggar lebih besar makan siang makin chaos dong,another prabowo program like building a village fund 5m 10000 scholarships and also need a bigger fencing lunch more chaotic dong
577,lah bilang program 02 dar makan siang gratis siapa juga mau maju lanjut bukan ubah ubah tentu bikin maju kalo maju udah bawa ubah anda tuju bangun ikn buat apa kalo bukan buat perata,"well said the 02 program from the free lunch who also wants to go forward, not change it, of course make it go forward if you go forward, take it change you go to build it for what if it's not for flatteners"
578,kalau bener jadi 2029 arti program laksana buat modal pilpres dong moy gemoy semua aja program kamu jalan akhir jabat 4 tahun pertama ongkang ongkang kaki jalanin bisnis ikn bareng adek nya,"if it really is 2029, the meaning of the program is like for the capital of the presidential election, dong moy gemoy, all your programs go to the end of the first 4 years ongkang ongkang kaki jalanin business ikn together with its adek"
579,program akan beban apbn ingat apbn kembang kempis ikn masih pakai apbn hutang lumayan jangan lupa situasi geopolitik masih mungkin program jalan,program will load apbn remember apbn deflated kembang ikn still use apbn considerable debt don't forget the geopolitical situation is still possible road program
580,sekolah tinggi sampe jadi dokter paham bijak sini gua ajarin nama bijak butuh anggar eksekutif bisa keluar anggar sah dpr jadi segala program bisa laksana dpr tuju contoh ikn tidak akan lanjut dpr,high school until a doctor understands wisely here I teach sage name needs executive fencing can come out legal fencing dpr so all programs can be like dpr aim for example ikn will not continue dpr
581,bayangin dana buat makan siang gratis sampe 400t per tahun sama dana buat ikn mana dana kamu tau kalo program naikin pajak sekarang malah udah muncul berita bakal pangkas subsidi bbm siapa kena dampak si miskin juga bsk2 harga sembako naik,shadowin fund for free lunch up to 400t per year the same fund for where do you know if the program increases taxes now even has emerged the news will cut bbm subsidies who is affected by the poor also bsk2 the price of groceries goes up
582,pdhl harap semua dpt kl skala prioritas knp ngomong dr awal arti mungkin yang dpt makanya dr awal sdh bilang kl program dungu tdk masuk akal sekarang benar kan kl tdk semua nya dpt duit nya dr mana ikn hutang kok hahaha,pdhl hope all can kl priority scale knp talk from the beginning meaning maybe that can be why from the beginning SDH said kl stupid program doesn't make sense now is it true kl not all of it can get the money from where ikn debt huh hahaha
583,rubah apa baik rubah masa tidak baik terusin masa uu kpk lemah ttp mau dilanjutin bukti akhir ketua kpknya malah kena masalah lagi program jokowi apa baik tidak mau diterusin 01 bansos blt ikn hilirasasi,fox what is good fox what is not good thenin time uu kpk weak but want to be extended the final evidence of the head of kpknya even got into trouble again jokowi program what is good do not want to be dozen 01 bansos blt ikn downstream
584,makanya blg makasih sama pak jkw udah mulai program normalisasi kali kanal banjir makanya kurang mkanya jangan buang smpah smbarangan biar g capek org ngeruk sampah dr kali bkin pompa berat smur resap g guna jakarta guna ikn lahan sepi lain,that's why thank you so much sir jkw has started the program of normalizing flood canal times so less money don't throw away smpah smbarangan so that people get tired of digging garbage from times bkin heavy pump smur infiltrate g use jakarta to use other deserted land
