,full_text,tweet_english
585,proyek pembangunam tidak hasil duit jelas bikin sulit realisasi kampung bayam tuh tinggal ngasih kunci aja sulit elite politik mana mau bikin program murni buat rakyat mau kan ada untung gede ikn contoh,"the development project is not the result of money, it is clear that it is difficult to realize the spinach village, it is just a matter of giving the key, it is difficult for the political elite, where to make a pure program for the people, there is a big profit, for example"
586,program pun tahap bisa mulai naik gaji jabat berantas korupsi lanjut ikn buat nampung jabat mulai makan gratis ikn,even the program stage can start to increase the salary of the postman eradicating corruption further IKN to accommodate the postman starting to eat free IKN
587,diskusi belum program kerja justru jangan kayak ikn balik,"discussion has not been a work program, just don't like it back"
588,orang ide emg cocok terap jakarta jkt padat bangun bukan lahan ikn notabene padat duduk ampun msh aja dibawa2 program gagal d jkt,people ideas emg fit terap jakarta jkt dense build not land ikn dense sit pardon msh aja brought2 failed program d jkt
589,justru sini letak masuk akal program makan kan bukan bangun ikn butuh tahap lama masalah uang engga kalo makan gratis yang mampu masuk akal,"precisely here is where it makes sense to eat, not wake up if you need a long stage of money problems, not if free eating is able to make sense"
590,okeeh kalo alas begini gua tanya nih dukung 02 udah baca cetak biru ikn 102 halaman belum kan lanjut nih ikn program nya jkw siap kawal ikn sampe jadi yang tulis program gakkk,okeeh if the base is like this I ask you to support 02 have read the blueprint of IKN 102 pages have not been continued yet the IKN program is ready to control the IKN sampe so who writes the program is not
591,video jelas memang program baik terus kalau ya kaji ulang ikn jelas juga memang ada program lanjut dr zaman sby,clear video is indeed a good program if yes review ikn it is clear there is also a further program from the sby era
592,emang gue bilang sama kamu kalau gue tuju sama bangun 30 kota tara jakarta dih jangan sok tau dong lihat tuh proker 02 makan gratis aja dana udah tara ikn ditumbalin subsidi bbm gas kamu mau nanggulangin inflasi apa kabar program bangun 500 fk,eang i told you that i'm going to build 30 cities tara jakarta dih jangan sok tau dong melihat tuh proker 02 makan gratis aja dana ara tara ikn dibumbalin subsidy bbm gas anda mau nanggulangin inflation apa kabar program Bangun 500 fk
593,program makan gratis indonesia bagi aku sulit realisasi harus potong subsidi anggar misal bbm didik tambah tahun mesti ngangsur hutang bunga itu ikn juga sedot apbn besar,free meal program indonesia for me difficult realization must cut fencing subsidies eg bbm students add years must install the interest debt ikn also suck big apbn
594,waduh dukung 02 sejak kapan mikirin hutang negara emang kalian lama mikir kalau bangun infrastruktur mana kalau bukan ngutang bangun ikn food estate bansos program makan siang susu gratis uras apbn tingkat utang negara woy,"wholeheartedly support 02 since when did you think about the state debt for a long time thinking if you build infrastructure where if you don't owe, wake up ikn food estate bansos free milk lunch program uras apbn level of state debt woy"
595,otak pas2an ush bnyk bacot nawarin makan gratis susu gratis bijilo gratis ikut semua biaya sangkut hajat hidup org bnyk subsidi bbm next tdl terus pbb uang sekolah dinaekin elu2 bangke2 maksa bngun ikn program otak pas2an kalian semua,brain pas2an ush bnyk bacot nawarin eat free milk free bijilo free follow all costs related to life people bnyk subsidy bbm next tdl continue pbb school fees dinaekin elu2 bangke2 maksa bngun ikn brain program pas2an all of you
596,sudah baca semua turut susah tagih janji karna beberapa definisi program turut kurang clear contoh 1 makan siangsusu gratis 2 hilir tetap fokus bangun sentral ikn 3 adil pasti hukum,have read all also difficult to collect promises because some program definitions are also less clear for example 1 free siangsusu meal 2 downstream still focus on building a central ikn 3 fair must be legal
597,program sampah kali kali gua debat kntor masalah program gajelas begini justru hrus sasar sejahtera lewat didik dapat keluarga nya biar kecup gizi si anak penuh bukan buang apbn 1 tahun makan siang gratis biaya bangun ikn cacad,garbage program kali kali gua debat kntor the problem of gajelas program like this is actually hrus sasar sejahtera through students can get their families so that the child's nutritional ketchup is full instead of throwing away apbn 1 year lunch free of charge to build ikn cacad
598,buset di highlight ni malah makan gratis nya miris padahal rata orang tengah atas mampu beli makan bukan orang miskin punya uang lagi kan program buat orang miskin tidak waras di highlight harus rencana bangun jangka panjang nya bos ikn,"the buset in this highlight actually eats it for free, even though the average middle man above is able to buy food, not the poor, has money anymore, right? the program for the poor is not sane in the highlight, it must be a long-term building plan for the boss"
599,inilo mereka tau sbnrnya benefitnya elite atas dukung prabowo potensi bisnis ikn main tambang cuan emg walaupun kaya tetep itu aja trus masa keblinger makan gratis program calon lain ketulung sumpah,inilo they know sbnrnya the benefits of the elite for supporting prabowo business potential ikn play cuan emg mine even though it is rich but only trus time keblinger eat free other candidates program ketulung swear
600,kalau orang2 sekitar dukung bcs 1 lanjutin ikn program jokowi 2 gibran bagus solo 3 gasuka pdip terus suka baca baik2nya aja,if people around support bcs 1 continue ikn program jokowi 2 good gibran solo 3 gasuka pdip continue to like to read well
