,full_text,tweet_english
676,apbn taun cuma 3300 triliun kalo mikir dikit sih jelas logis kan anggar 450t taun buat program makan mana 450t tara proyek ikn wkwk,"apbn taun only 3300 trillion if you think about it, it's clear that it's logical right fencing 450t taun for which meal program 450t tara project ikn wkwk"
677,anggar program makan tara ikn ikn lanjut stunting turun gitu aja makan gratis engga perlu bareng dg baik fasilitas edukasi masih ada anggar belum anggar 300 fk duit mana,fencing eating program tara ikn ikn further stunting down like that just eat for free don't need to be together with good educational facilities there are still fencing yet fencing 300 fk which money
678,itu masuk main program selain ikn hilir jadi bisa dilakuin awal2 tahun jabat,it enters the main program other than downstream ikn so it can be done early in the year
679,engga bang makasih gue udah coba hasil nihil pendeketan gue lakuin agam mulai duduk bareng ngopi becanda udah gue caci maki ama tuatua kalimat udahlah ikut jelas mau lanjutin program ikn aja biar jakarta rada sepi damn,engga bang thank you I've tried the results of zero shortsightedness I'm behaving agam began to sit together coffee becanda I've cussed ama tuatua sentence already clear want to continue the program ikn aja so jakarta rada lonely damn
680,masa masalah anggar rencana dulu buat program si jangan jangan dana mau dipake ikn dulu atau justru program makan gratis susu gratis seperti teknik bansos rezim tengah mau lengser thats the logic,"during the fencing problem, plan first for the program, don't don't don't want to be used ikn first or even a free milk free meal program like the bansos technique, the regime is going to fall thats the logic"
681,bingung banget ada pikir ah udahlah gampang penting jadi presiden dulu kalau logis gua sih ketar tir 300 fakultas dokter 13 kota baru ikn makan siang 460t tahun hilir beasiswa yang lain kalau gua mikirin terus sih program gk masuk akal,"confused there is thinking ah it's easy it's important to be the president first if it's logical that I'm talking about 300 faculties of doctors 13 new cities I want to have lunch 460t downstream of other scholarships if I think about it, the program makes sense"
682,realisasi dapat per kapita tara negara maju dulu atuh baru mikirin program makan siang gratis lah makan siang gratis ikn bangun infrastruktur terobos sekali apbn semua kacau hobi banget nerobos,realization can be per capita tara developed countries first or just think of a free lunch program is a free lunch to build a breakthrough infrastructure once apbn all messed up hobbies really nerobos
683,tau bukan lanjut kak program pak jokowi khusus ikn kaji ulang mmg habis apbn sangat besar turut paslon 01 dana alokasi anggar yang lebih urgent perata fasilitas didik sehat,"know instead of continuing, sir, jokowi special program, ikn, review, mmg, out of apbn, very large, participated in paslon 01, fencing allocation fund, which is more urgent, the average of healthy student facilities"
684,3x milu pernah bener buat ikn bisa buat program hitung kpu macam apa begini dana trilyunan kok aplikasi hitung milu ecekecek begini apa tka harus laku 275 juta rakyat indonesia ada bener apa,3x milu have ever been right to be able to make a kpu count program like this trillions of funds why is the milu ecekecek application counting like this what should it do? 275 million Indonesians are right
685,mana statement amin bilang bakal batalin ikn ada tuh dimasukin program nyapres sekarang jd bangun ttp lanjut dengan alokasi dana lebih sedikit,where amen's statement says there will be a batalin ikn in his program presently jd wake up ttp further with less allocation of funds
686,aku pas liat mengagung2kan program beneran heran mereka apa pikir yang ya kya biaya realisasi program besar bhkn udah spill dana yang dibutuhin lbh besar dr bangun ikn dapet darimana dana ya pajak dinaikin lg,"i look at the program really amazed them what do you think about the cost of realizing a big program, bhkn already spill the funds needed by the big LBH from building ikn to get where the funds are from, the tax is raised lg"
687,kalo bangga sama pimpin sendiri yauda gausa cari lowong ikn gausa pake bpjs ikut2 program lain,if you are proud to lead your own yauda gausa find vacancies ikn gausa use bpjs participate in other programs
688,mampus lah kalian org org tolol akut percaya dg program masuk akal mana mungkin 400t tahun buat kasih makan kalian tara biaya bikin ikn,fuck you morons acute believe with a reasonable program where it might be 400t years to feed you tara cost to make ikn
689,program jalan tahun 4 lalu program jalan saat maju jadi caprescawapres narasi siapa tuju program lanjut startegi pilih biar program terus lanjut sama program ikn,the road program in year 4 and then the road program when advancing to become a presidential candidate narrative who is going to continue the program startegi choose so that the program continues with the IKN program
690,begini kalo suatu program jadi alat kampanye buat ugalugalan kaji sama kaya ikn,like this if a program becomes a campaign tool for ugalugalan studi sama kaya ikn
691,nama anies tidak pernah lanjut program lama lihat di dki semua waris ahok rusak sama kalo menang pertama stop ikn lalu hilir stop kemudian program2 jokowi lain,name anies never continue the old program see in dki all heirs ahok damaged the same if you win first stop ikn then downstream stop then other jokowi programs
692,mungkin tidak mungkin gantung mau dijadiin program prioritas tidak masalah bangun 40 kota duit darimana ikn tunda 40 kota bukan 0 dari kota emang udah kembang,it may not be possible to hang to be a priority program no matter how to build 40 money cities from where to delay 40 cities instead of 0 from the city already developed
693,malah programprogram tidak dijanjiin kampanye jalan cepat like kereta cepat ikn uu ite omnibus law lemah kpk yahh begini lanjut 5 tahun depan,even the program is not promised a fast road campaign like a fast train ikn uu ite omnibus law weak kpk yahh like this further 5 next year
